{
  "schemaVersion": 2,
  "id": "L037",
  "name": "Reverse Spur",
  "seed": 4037,
  "meta": {
    "band": "oneway",
    "difficultyTarget": 0.73,
    "mechanics": ["switch", "budget", "reversible"],
    "newMechanic": "reversible",
    "teachingGoal": "Send a blue train backward along the reversible spur, then release red",
    "minActionWindowTicks": 3,
    "authoredBy": "llm+validator"
  },
  "board": {
    "nodes": [
      { "id": "SRC", "x": 0, "y": 7 },
      { "id": "J1", "x": 0, "y": 4, "queueCapacity": 4 },
      { "id": "RED", "x": -3, "y": 1 },
      { "id": "BLUE", "x": 3, "y": 1 }
    ],
    "edges": [
      { "id": "E_IN", "from": "SRC", "to": "J1", "travelTicks": 3 },
      { "id": "E_RED", "from": "J1", "to": "RED", "travelTicks": 3 },
      { "id": "E_SPUR", "from": "BLUE", "to": "J1", "travelTicks": 3, "reversible": true }
    ]
  },
  "sources": [
    { "nodeId": "SRC", "allowedColors": ["red", "blue"] }
  ],
  "stations": [
    { "nodeId": "RED", "accepts": ["red"], "capacity": 4 },
    { "nodeId": "BLUE", "accepts": ["blue"], "capacity": 4 }
  ],
  "switches": [
    { "id": "S1", "nodeId": "J1", "routes": ["E_SPUR", "E_RED"], "initialRoute": 0 }
  ],
  "waves": [
    { "tick": 2, "sourceNode": "SRC", "color": "blue", "count": 1, "spacingTicks": 8 },
    { "tick": 10, "sourceNode": "SRC", "color": "red", "count": 1, "spacingTicks": 8 }
  ],
  "win": {
    "deliveries": 2,
    "timeLimitTicks": 24,
    "perfectMaxSwitches": 1,
    "stars": { "two": 260, "three": 440 }
  },
  "economy": { "baseTickets": 62, "perfectBonus": 26 }
}
