{
  "schemaVersion": 2,
  "id": "L013",
  "name": "One Flip Only",
  "seed": 1013,
  "meta": {
    "band": "budget",
    "difficultyTarget": 0.25,
    "mechanics": ["switch", "budget"],
    "newMechanic": "budget",
    "teachingGoal": "Spend the single available route change on the one cat that cannot arrive otherwise",
    "minActionWindowTicks": 16,
    "authoredBy": "llm+validator"
  },
  "board": {
    "nodes": [
      { "id": "SRC", "x": 3, "y": 9 },
      { "id": "J1", "x": 3, "y": 5 },
      { "id": "RED", "x": 0, "y": 1 },
      { "id": "BLUE", "x": 6, "y": 1 }
    ],
    "edges": [
      { "id": "E_IN", "from": "SRC", "to": "J1", "travelTicks": 10 },
      { "id": "E_RED", "from": "J1", "to": "RED", "travelTicks": 10 },
      { "id": "E_BLUE", "from": "J1", "to": "BLUE", "travelTicks": 10 }
    ]
  },
  "sources": [
    { "nodeId": "SRC", "allowedColors": ["red"] }
  ],
  "stations": [
    { "nodeId": "RED", "accepts": ["red"], "capacity": 8 },
    { "nodeId": "BLUE", "accepts": ["blue"], "capacity": 8 }
  ],
  "switches": [
    { "id": "S1", "nodeId": "J1", "routes": ["E_RED", "E_BLUE"], "initialRoute": 1 }
  ],
  "waves": [
    { "tick": 12, "sourceNode": "SRC", "color": "red", "count": 1, "spacingTicks": 12 }
  ],
  "win": {
    "deliveries": 1,
    "timeLimitTicks": 220,
    "perfectMaxSwitches": 1,
    "stars": { "two": 600, "three": 780 }
  },
  "economy": { "baseTickets": 32, "perfectBonus": 16 }
}
