{"schemaVersion":2,"id":"L018","name":"Two Platforms","seed":1018,"meta":{"band":"two-source","difficultyTarget":0.38,"mechanics":["switch","queue","second-source"],"newMechanic":"second-source","teachingGoal":"Prioritize between two interleaved sources sharing one junction","minActionWindowTicks":10,"authoredBy":"llm+validator"},"board":{"nodes":[{"id":"SA","x":1,"y":9},{"id":"SB","x":5,"y":9},{"id":"M","x":3,"y":7,"queueCapacity":3},{"id":"J1","x":3,"y":5,"queueCapacity":2},{"id":"RED","x":1,"y":2},{"id":"BLU","x":5,"y":2}],"edges":[{"id":"EA","from":"SA","to":"M","travelTicks":8},{"id":"EB","from":"SB","to":"M","travelTicks":8},{"id":"EM","from":"M","to":"J1","travelTicks":6},{"id":"ER","from":"J1","to":"RED","travelTicks":10},{"id":"EU","from":"J1","to":"BLU","travelTicks":10}]},"sources":[{"nodeId":"SA","allowedColors":["red"]},{"nodeId":"SB","allowedColors":["blue"]}],"stations":[{"nodeId":"RED","accepts":["red"],"capacity":6},{"nodeId":"BLU","accepts":["blue"],"capacity":6}],"switches":[{"id":"S1","nodeId":"J1","routes":["ER","EU"],"initialRoute":0}],"waves":[{"tick":8,"sourceNode":"SA","color":"red","count":3,"spacingTicks":14},{"tick":50,"sourceNode":"SB","color":"blue","count":3,"spacingTicks":14},{"tick":106,"sourceNode":"SA","color":"red","count":2,"spacingTicks":14},{"tick":148,"sourceNode":"SB","color":"blue","count":2,"spacingTicks":14}],"win":{"deliveries":10,"timeLimitTicks":300,"perfectMaxSwitches":4,"stars":{"two":900,"three":1200}},"economy":{"baseTickets":30,"perfectBonus":20}}
