{
  "schemaVersion": 2,
  "id": "L003",
  "name": "Three Cozy Turns",
  "seed": 1003,
  "meta": {
    "band": "onboarding",
    "difficultyTarget": 0.09,
    "mechanics": ["switch"],
    "newMechanic": null,
    "teachingGoal": "Read three well-spaced arrivals and move the same lever for each colour change",
    "minActionWindowTicks": 16,
    "authoredBy": "llm+validator"
  },
  "board": {
    "nodes": [
      { "id": "SRC", "x": 3, "y": 10 },
      { "id": "J1", "x": 3, "y": 6 },
      { "id": "RED", "x": 0, "y": 2 },
      { "id": "BLUE", "x": 6, "y": 2 }
    ],
    "edges": [
      { "id": "E_IN", "from": "SRC", "to": "J1", "travelTicks": 10 },
      { "id": "E_RED", "from": "J1", "to": "RED", "travelTicks": 12 },
      { "id": "E_BLUE", "from": "J1", "to": "BLUE", "travelTicks": 12 }
    ]
  },
  "sources": [
    { "nodeId": "SRC", "allowedColors": ["red", "blue"] }
  ],
  "stations": [
    { "nodeId": "RED", "accepts": ["red"], "capacity": 6 },
    { "nodeId": "BLUE", "accepts": ["blue"], "capacity": 6 }
  ],
  "switches": [
    { "id": "S1", "nodeId": "J1", "routes": ["E_RED", "E_BLUE"], "initialRoute": 1 }
  ],
  "waves": [
    { "tick": 8, "sourceNode": "SRC", "color": "red", "count": 1, "spacingTicks": 12 },
    { "tick": 44, "sourceNode": "SRC", "color": "blue", "count": 1, "spacingTicks": 12 },
    { "tick": 80, "sourceNode": "SRC", "color": "red", "count": 1, "spacingTicks": 12 }
  ],
  "win": {
    "deliveries": 3,
    "timeLimitTicks": 260,
    "stars": { "two": 260, "three": 380 }
  },
  "economy": { "baseTickets": 22, "perfectBonus": 11 }
}
