{
  "schemaVersion": 2,
  "id": "L029",
  "name": "Portal Merge",
  "seed": 2029,
  "meta": {
    "band": "combination",
    "difficultyTarget": 0.57,
    "mechanics": ["switch", "budget", "second-source", "cooldown", "tunnel"],
    "newMechanic": null,
    "teachingGoal": "Merge a tunneled red line with a blue feeder under one cooled lever",
    "minActionWindowTicks": 3,
    "authoredBy": "llm+validator"
  },
  "board": {
    "nodes": [
      { "id": "SA", "x": -2, "y": 6 },
      { "id": "SB", "x": 2, "y": 6 },
      { "id": "J1", "x": 0, "y": 3, "queueCapacity": 4 },
      { "id": "RED", "x": -2, "y": 0 },
      { "id": "BLUE", "x": 2, "y": 0 }
    ],
    "edges": [
      { "id": "E_PORTAL", "from": "SA", "to": "J1", "travelTicks": 3, "tunnel": true },
      { "id": "E_FEED", "from": "SB", "to": "J1", "travelTicks": 3 },
      { "id": "E_RED", "from": "J1", "to": "RED", "travelTicks": 4 },
      { "id": "E_BLUE", "from": "J1", "to": "BLUE", "travelTicks": 4 }
    ]
  },
  "sources": [
    { "nodeId": "SA", "allowedColors": ["red"] },
    { "nodeId": "SB", "allowedColors": ["blue"] }
  ],
  "stations": [
    { "nodeId": "RED", "accepts": ["red"], "capacity": 4 },
    { "nodeId": "BLUE", "accepts": ["blue"], "capacity": 4 }
  ],
  "switches": [
    { "id": "S1", "nodeId": "J1", "routes": ["E_RED", "E_BLUE"], "initialRoute": 1, "cooldownTicks": 2 }
  ],
  "waves": [
    { "tick": 2, "sourceNode": "SA", "color": "red", "count": 1, "spacingTicks": 8 },
    { "tick": 8, "sourceNode": "SB", "color": "blue", "count": 1, "spacingTicks": 8 }
  ],
  "win": {
    "deliveries": 2,
    "timeLimitTicks": 20,
    "perfectMaxSwitches": 2,
    "stars": { "two": 210, "three": 360 }
  },
  "economy": { "baseTickets": 46, "perfectBonus": 19 }
}
