{
  "schemaVersion": 2,
  "id": "L025",
  "name": "Portal Pair",
  "seed": 2025,
  "meta": {
    "band": "tunnel",
    "difficultyTarget": 0.49,
    "mechanics": ["switch", "budget", "tunnel"],
    "newMechanic": "tunnel",
    "teachingGoal": "Follow the cat through the paired portals before choosing its station",
    "minActionWindowTicks": 3,
    "authoredBy": "llm+validator"
  },
  "board": {
    "nodes": [
      { "id": "PORTAL_A", "x": 0, "y": 6 },
      { "id": "PORTAL_B", "x": 0, "y": 3, "queueCapacity": 4 },
      { "id": "RED", "x": -2, "y": 0 },
      { "id": "SIDING", "x": 2, "y": 0 }
    ],
    "edges": [
      { "id": "E_TUNNEL", "from": "PORTAL_A", "to": "PORTAL_B", "travelTicks": 3, "tunnel": true },
      { "id": "E_RED", "from": "PORTAL_B", "to": "RED", "travelTicks": 4 },
      { "id": "E_SIDING", "from": "PORTAL_B", "to": "SIDING", "travelTicks": 4 }
    ]
  },
  "sources": [
    { "nodeId": "PORTAL_A", "allowedColors": ["red"] }
  ],
  "stations": [
    { "nodeId": "RED", "accepts": ["red"], "capacity": 4 }
  ],
  "switches": [
    { "id": "S1", "nodeId": "PORTAL_B", "routes": ["E_RED", "E_SIDING"], "initialRoute": 1 }
  ],
  "waves": [
    { "tick": 2, "sourceNode": "PORTAL_A", "color": "red", "count": 1, "spacingTicks": 8 }
  ],
  "win": {
    "deliveries": 1,
    "timeLimitTicks": 22,
    "perfectMaxSwitches": 1,
    "stars": { "two": 170, "three": 300 }
  },
  "economy": { "baseTickets": 38, "perfectBonus": 15 }
}
