{
  "schemaVersion": 2,
  "id": "L004",
  "name": "The Depot Fork",
  "seed": 1004,
  "meta": {
    "band": "onboarding",
    "difficultyTarget": 0.11,
    "mechanics": ["switch"],
    "newMechanic": null,
    "teachingGoal": "Open the route into the depot, then use its second lever to separate red and blue",
    "minActionWindowTicks": 16,
    "authoredBy": "llm+validator"
  },
  "board": {
    "nodes": [
      { "id": "SRC", "x": 4, "y": 10 },
      { "id": "ENTRY", "x": 4, "y": 7 },
      { "id": "SORT", "x": 4, "y": 4 },
      { "id": "RED", "x": 1, "y": 1 },
      { "id": "BLUE", "x": 7, "y": 1 },
      { "id": "YARD", "x": 7, "y": 7 }
    ],
    "edges": [
      { "id": "E_IN", "from": "SRC", "to": "ENTRY", "travelTicks": 12 },
      { "id": "E_DEPOT", "from": "ENTRY", "to": "SORT", "travelTicks": 8 },
      { "id": "E_YARD", "from": "ENTRY", "to": "YARD", "travelTicks": 12 },
      { "id": "E_RED", "from": "SORT", "to": "RED", "travelTicks": 10 },
      { "id": "E_BLUE", "from": "SORT", "to": "BLUE", "travelTicks": 10 }
    ]
  },
  "sources": [
    { "nodeId": "SRC", "allowedColors": ["red", "blue"] }
  ],
  "stations": [
    { "nodeId": "RED", "accepts": ["red"], "capacity": 6 },
    { "nodeId": "BLUE", "accepts": ["blue"], "capacity": 6 },
    { "nodeId": "YARD", "accepts": ["green"], "capacity": 6 }
  ],
  "switches": [
    { "id": "S_ENTRY", "nodeId": "ENTRY", "routes": ["E_DEPOT", "E_YARD"], "initialRoute": 1 },
    { "id": "S_SORT", "nodeId": "SORT", "routes": ["E_RED", "E_BLUE"], "initialRoute": 0 }
  ],
  "waves": [
    { "tick": 8, "sourceNode": "SRC", "color": "red", "count": 1, "spacingTicks": 12 },
    { "tick": 48, "sourceNode": "SRC", "color": "blue", "count": 1, "spacingTicks": 12 }
  ],
  "win": {
    "deliveries": 2,
    "timeLimitTicks": 280,
    "stars": { "two": 300, "three": 430 }
  },
  "economy": { "baseTickets": 23, "perfectBonus": 12 }
}
