{
  "schemaVersion": 2,
  "id": "L006",
  "name": "Alternating Line",
  "seed": 1006,
  "meta": {
    "band": "alternation",
    "difficultyTarget": 0.2,
    "mechanics": [
      "switch",
      "queue"
    ],
    "newMechanic": null,
    "teachingGoal": "Read the next-wave preview and alternate the switch in rhythm",
    "minActionWindowTicks": 12,
    "authoredBy": "llm+validator"
  },
  "board": {
    "nodes": [
      {
        "id": "SRC",
        "x": 3,
        "y": 9
      },
      {
        "id": "J1",
        "x": 3,
        "y": 6,
        "queueCapacity": 3
      },
      {
        "id": "RED",
        "x": 1,
        "y": 2
      },
      {
        "id": "BLU",
        "x": 5,
        "y": 2
      }
    ],
    "edges": [
      {
        "id": "E1",
        "from": "SRC",
        "to": "J1",
        "travelTicks": 8
      },
      {
        "id": "E2",
        "from": "J1",
        "to": "RED",
        "travelTicks": 12
      },
      {
        "id": "E3",
        "from": "J1",
        "to": "BLU",
        "travelTicks": 12
      }
    ]
  },
  "sources": [
    {
      "nodeId": "SRC",
      "allowedColors": [
        "red",
        "blue"
      ]
    }
  ],
  "stations": [
    {
      "nodeId": "RED",
      "accepts": [
        "red"
      ],
      "capacity": 5
    },
    {
      "nodeId": "BLU",
      "accepts": [
        "blue"
      ],
      "capacity": 5
    }
  ],
  "switches": [
    {
      "id": "S1",
      "nodeId": "J1",
      "routes": [
        "E2",
        "E3"
      ],
      "initialRoute": 0
    }
  ],
  "waves": [
    {
      "tick": 8,
      "sourceNode": "SRC",
      "color": "red",
      "count": 2,
      "spacingTicks": 16
    },
    {
      "tick": 48,
      "sourceNode": "SRC",
      "color": "blue",
      "count": 2,
      "spacingTicks": 16
    },
    {
      "tick": 88,
      "sourceNode": "SRC",
      "color": "red",
      "count": 2,
      "spacingTicks": 16
    },
    {
      "tick": 128,
      "sourceNode": "SRC",
      "color": "blue",
      "count": 2,
      "spacingTicks": 16
    }
  ],
  "win": {
    "deliveries": 8,
    "timeLimitTicks": 260,
    "perfectMaxSwitches": 4,
    "stars": {
      "two": 700,
      "three": 950
    }
  },
  "economy": {
    "baseTickets": 25,
    "perfectBonus": 15
  }
}
