{
  "schemaVersion": 2,
  "id": "L008",
  "name": "Queue to the Yard",
  "seed": 1008,
  "meta": {
    "band": "onboarding",
    "difficultyTarget": 0.16,
    "mechanics": ["switch", "queue"],
    "newMechanic": null,
    "teachingGoal": "Release a waiting pair through the entry lever, then sort the final colour downstream",
    "minActionWindowTicks": 12,
    "authoredBy": "llm+validator"
  },
  "board": {
    "nodes": [
      { "id": "SRC", "x": 4, "y": 11, "queueCapacity": 3 },
      { "id": "ENTRY", "x": 4, "y": 8 },
      { "id": "SORT", "x": 4, "y": 4 },
      { "id": "RED", "x": 1, "y": 1 },
      { "id": "BLUE", "x": 7, "y": 1 },
      { "id": "YARD", "x": 7, "y": 8 }
    ],
    "edges": [
      { "id": "E_IN", "from": "SRC", "to": "ENTRY", "travelTicks": 9 },
      { "id": "E_SORT", "from": "ENTRY", "to": "SORT", "travelTicks": 9 },
      { "id": "E_YARD", "from": "ENTRY", "to": "YARD", "travelTicks": 12 },
      { "id": "E_RED", "from": "SORT", "to": "RED", "travelTicks": 10 },
      { "id": "E_BLUE", "from": "SORT", "to": "BLUE", "travelTicks": 10 }
    ]
  },
  "sources": [
    { "nodeId": "SRC", "allowedColors": ["red", "blue"] }
  ],
  "stations": [
    { "nodeId": "RED", "accepts": ["red"], "capacity": 8 },
    { "nodeId": "BLUE", "accepts": ["blue"], "capacity": 8 },
    { "nodeId": "YARD", "accepts": ["green"], "capacity": 8 }
  ],
  "switches": [
    { "id": "S_ENTRY", "nodeId": "ENTRY", "routes": ["E_SORT", "E_YARD"], "initialRoute": 1 },
    { "id": "S_SORT", "nodeId": "SORT", "routes": ["E_RED", "E_BLUE"], "initialRoute": 0 }
  ],
  "waves": [
    { "tick": 8, "sourceNode": "SRC", "color": "red", "count": 1, "spacingTicks": 12 },
    { "tick": 8, "sourceNode": "SRC", "color": "red", "count": 1, "spacingTicks": 12 },
    { "tick": 64, "sourceNode": "SRC", "color": "blue", "count": 1, "spacingTicks": 12 }
  ],
  "win": {
    "deliveries": 3,
    "timeLimitTicks": 340,
    "stars": { "two": 450, "three": 600 }
  },
  "economy": { "baseTickets": 27, "perfectBonus": 14 }
}
