{
  "schemaVersion": 2,
  "id": "L012",
  "name": "Three-Way Sorting",
  "seed": 1012,
  "meta": {
    "band": "shape",
    "difficultyTarget": 0.24,
    "mechanics": ["switch", "shape"],
    "newMechanic": null,
    "teachingGoal": "Use an entry split and a second shape lever to master a hierarchical badge route",
    "minActionWindowTicks": 14,
    "authoredBy": "llm+validator"
  },
  "board": {
    "nodes": [
      { "id": "SRC", "x": 4, "y": 11 },
      { "id": "ENTRY", "x": 4, "y": 8 },
      { "id": "SORT", "x": 5, "y": 4 },
      { "id": "ROUND", "x": 0, "y": 3 },
      { "id": "SQUARE", "x": 3, "y": 0 },
      { "id": "TRIANGLE", "x": 8, "y": 1 }
    ],
    "edges": [
      { "id": "E_IN", "from": "SRC", "to": "ENTRY", "travelTicks": 9 },
      { "id": "E_ROUND", "from": "ENTRY", "to": "ROUND", "travelTicks": 13 },
      { "id": "E_SORT", "from": "ENTRY", "to": "SORT", "travelTicks": 9 },
      { "id": "E_SQUARE", "from": "SORT", "to": "SQUARE", "travelTicks": 11 },
      { "id": "E_TRIANGLE", "from": "SORT", "to": "TRIANGLE", "travelTicks": 11 }
    ]
  },
  "sources": [
    { "nodeId": "SRC", "allowedColors": ["red"] }
  ],
  "stations": [
    { "nodeId": "ROUND", "accepts": ["red"], "capacity": 8, "shape": "round" },
    { "nodeId": "SQUARE", "accepts": ["red"], "capacity": 8, "shape": "square" },
    { "nodeId": "TRIANGLE", "accepts": ["red"], "capacity": 8, "shape": "triangle" }
  ],
  "switches": [
    { "id": "S_ENTRY", "nodeId": "ENTRY", "routes": ["E_ROUND", "E_SORT"], "initialRoute": 0 },
    { "id": "S_SORT", "nodeId": "SORT", "routes": ["E_SQUARE", "E_TRIANGLE"], "initialRoute": 0 }
  ],
  "waves": [
    { "tick": 8, "sourceNode": "SRC", "color": "red", "count": 1, "spacingTicks": 12, "shape": "round" },
    { "tick": 32, "sourceNode": "SRC", "color": "red", "count": 1, "spacingTicks": 12, "shape": "square" },
    { "tick": 56, "sourceNode": "SRC", "color": "red", "count": 1, "spacingTicks": 12, "shape": "triangle" }
  ],
  "win": {
    "deliveries": 3,
    "timeLimitTicks": 135,
    "stars": { "two": 580, "three": 760 }
  },
  "economy": { "baseTickets": 31, "perfectBonus": 16 }
}
