{
  "schemaVersion": 2,
  "id": "L010",
  "name": "Shape Carousel",
  "seed": 1010,
  "meta": {
    "band": "shape",
    "difficultyTarget": 0.19,
    "mechanics": ["switch", "shape"],
    "newMechanic": null,
    "teachingGoal": "Advance one stop around the lever for each badge in a three-shape sequence",
    "minActionWindowTicks": 16,
    "authoredBy": "llm+validator"
  },
  "board": {
    "nodes": [
      { "id": "SRC", "x": 5, "y": 10 },
      { "id": "J1", "x": 5, "y": 6 },
      { "id": "ROUND", "x": 1, "y": 2 },
      { "id": "SQUARE", "x": 5, "y": 1 },
      { "id": "TRIANGLE", "x": 9, "y": 2 }
    ],
    "edges": [
      { "id": "E_IN", "from": "SRC", "to": "J1", "travelTicks": 9 },
      { "id": "E_ROUND", "from": "J1", "to": "ROUND", "travelTicks": 12 },
      { "id": "E_SQUARE", "from": "J1", "to": "SQUARE", "travelTicks": 10 },
      { "id": "E_TRIANGLE", "from": "J1", "to": "TRIANGLE", "travelTicks": 12 }
    ]
  },
  "sources": [
    { "nodeId": "SRC", "allowedColors": ["blue"] }
  ],
  "stations": [
    { "nodeId": "ROUND", "accepts": ["blue"], "capacity": 8, "shape": "round" },
    { "nodeId": "SQUARE", "accepts": ["blue"], "capacity": 8, "shape": "square" },
    { "nodeId": "TRIANGLE", "accepts": ["blue"], "capacity": 8, "shape": "triangle" }
  ],
  "switches": [
    { "id": "S1", "nodeId": "J1", "routes": ["E_ROUND", "E_SQUARE", "E_TRIANGLE"], "initialRoute": 0 }
  ],
  "waves": [
    { "tick": 8, "sourceNode": "SRC", "color": "blue", "count": 1, "spacingTicks": 12, "shape": "round" },
    { "tick": 28, "sourceNode": "SRC", "color": "blue", "count": 1, "spacingTicks": 12, "shape": "square" },
    { "tick": 48, "sourceNode": "SRC", "color": "blue", "count": 1, "spacingTicks": 12, "shape": "triangle" }
  ],
  "win": {
    "deliveries": 3,
    "timeLimitTicks": 160,
    "stars": { "two": 500, "three": 660 }
  },
  "economy": { "baseTickets": 29, "perfectBonus": 15 }
}
