{
  "schemaVersion": 2,
  "id": "L011",
  "name": "Badge Parade",
  "seed": 1011,
  "meta": {
    "band": "shape",
    "difficultyTarget": 0.22,
    "mechanics": ["switch", "shape"],
    "newMechanic": null,
    "teachingGoal": "Hold one shape route for a repeated badge before moving on to the final platform",
    "minActionWindowTicks": 14,
    "authoredBy": "llm+validator"
  },
  "board": {
    "nodes": [
      { "id": "SRC", "x": 4, "y": 11 },
      { "id": "J1", "x": 4, "y": 6 },
      { "id": "ROUND", "x": 0, "y": 2 },
      { "id": "TRIANGLE", "x": 4, "y": 1 },
      { "id": "SQUARE", "x": 8, "y": 2 }
    ],
    "edges": [
      { "id": "E_IN", "from": "SRC", "to": "J1", "travelTicks": 11 },
      { "id": "E_ROUND", "from": "J1", "to": "ROUND", "travelTicks": 12 },
      { "id": "E_TRIANGLE", "from": "J1", "to": "TRIANGLE", "travelTicks": 10 },
      { "id": "E_SQUARE", "from": "J1", "to": "SQUARE", "travelTicks": 12 }
    ]
  },
  "sources": [
    { "nodeId": "SRC", "allowedColors": ["green"] }
  ],
  "stations": [
    { "nodeId": "ROUND", "accepts": ["green"], "capacity": 8, "shape": "round" },
    { "nodeId": "TRIANGLE", "accepts": ["green"], "capacity": 8, "shape": "triangle" },
    { "nodeId": "SQUARE", "accepts": ["green"], "capacity": 8, "shape": "square" }
  ],
  "switches": [
    { "id": "S1", "nodeId": "J1", "routes": ["E_ROUND", "E_TRIANGLE", "E_SQUARE"], "initialRoute": 0 }
  ],
  "waves": [
    { "tick": 8, "sourceNode": "SRC", "color": "green", "count": 1, "spacingTicks": 12, "shape": "round" },
    { "tick": 28, "sourceNode": "SRC", "color": "green", "count": 1, "spacingTicks": 12, "shape": "triangle" },
    { "tick": 48, "sourceNode": "SRC", "color": "green", "count": 1, "spacingTicks": 12, "shape": "triangle" },
    { "tick": 68, "sourceNode": "SRC", "color": "green", "count": 1, "spacingTicks": 12, "shape": "square" }
  ],
  "win": {
    "deliveries": 4,
    "timeLimitTicks": 190,
    "stars": { "two": 540, "three": 710 }
  },
  "economy": { "baseTickets": 30, "perfectBonus": 15 }
}
