{
  "schemaVersion": 2,
  "id": "L016",
  "name": "Last Flip Home",
  "seed": 1016,
  "meta": {
    "band": "budget",
    "difficultyTarget": 0.32,
    "mechanics": ["switch", "budget"],
    "newMechanic": null,
    "teachingGoal": "Open the depot once, then count two more changes around its three-route sorting lever",
    "minActionWindowTicks": 14,
    "authoredBy": "llm+validator"
  },
  "board": {
    "nodes": [
      { "id": "SRC", "x": 5, "y": 11 },
      { "id": "ENTRY", "x": 5, "y": 8 },
      { "id": "SORT", "x": 5, "y": 5 },
      { "id": "RED", "x": 0, "y": 1 },
      { "id": "BLUE", "x": 4, "y": 0 },
      { "id": "GREEN", "x": 9, "y": 1 },
      { "id": "YARD", "x": 9, "y": 8 }
    ],
    "edges": [
      { "id": "E_IN", "from": "SRC", "to": "ENTRY", "travelTicks": 9 },
      { "id": "E_SORT", "from": "ENTRY", "to": "SORT", "travelTicks": 9 },
      { "id": "E_YARD", "from": "ENTRY", "to": "YARD", "travelTicks": 12 },
      { "id": "E_RED", "from": "SORT", "to": "RED", "travelTicks": 12 },
      { "id": "E_BLUE", "from": "SORT", "to": "BLUE", "travelTicks": 10 },
      { "id": "E_GREEN", "from": "SORT", "to": "GREEN", "travelTicks": 12 }
    ]
  },
  "sources": [
    { "nodeId": "SRC", "allowedColors": ["green"] }
  ],
  "stations": [
    { "nodeId": "RED", "accepts": ["red"], "capacity": 8 },
    { "nodeId": "BLUE", "accepts": ["blue"], "capacity": 8 },
    { "nodeId": "GREEN", "accepts": ["green"], "capacity": 8 },
    { "nodeId": "YARD", "accepts": ["yellow"], "capacity": 8 }
  ],
  "switches": [
    { "id": "S_ENTRY", "nodeId": "ENTRY", "routes": ["E_SORT", "E_YARD"], "initialRoute": 1 },
    { "id": "S_SORT", "nodeId": "SORT", "routes": ["E_RED", "E_BLUE", "E_GREEN"], "initialRoute": 0 }
  ],
  "waves": [
    { "tick": 8, "sourceNode": "SRC", "color": "green", "count": 1, "spacingTicks": 12 }
  ],
  "win": {
    "deliveries": 1,
    "timeLimitTicks": 300,
    "perfectMaxSwitches": 3,
    "stars": { "two": 700, "three": 900 }
  },
  "economy": { "baseTickets": 35, "perfectBonus": 18 }
}
