{
  "schemaVersion": 2,
  "id": "L015",
  "name": "Budgeted Badges",
  "seed": 1015,
  "meta": {
    "band": "budget",
    "difficultyTarget": 0.30,
    "mechanics": ["switch", "shape", "budget"],
    "newMechanic": null,
    "teachingGoal": "Count exactly two changes from the round route to the triangle badge",
    "minActionWindowTicks": 14,
    "authoredBy": "llm+validator"
  },
  "board": {
    "nodes": [
      { "id": "SRC", "x": 4, "y": 10 },
      { "id": "J1", "x": 4, "y": 6 },
      { "id": "ROUND", "x": 0, "y": 1 },
      { "id": "SQUARE", "x": 4, "y": 1 },
      { "id": "TRIANGLE", "x": 8, "y": 1 }
    ],
    "edges": [
      { "id": "E_IN", "from": "SRC", "to": "J1", "travelTicks": 10 },
      { "id": "E_ROUND", "from": "J1", "to": "ROUND", "travelTicks": 11 },
      { "id": "E_SQUARE", "from": "J1", "to": "SQUARE", "travelTicks": 11 },
      { "id": "E_TRIANGLE", "from": "J1", "to": "TRIANGLE", "travelTicks": 11 }
    ]
  },
  "sources": [
    { "nodeId": "SRC", "allowedColors": ["yellow"] }
  ],
  "stations": [
    { "nodeId": "ROUND", "accepts": ["yellow"], "capacity": 8, "shape": "round" },
    { "nodeId": "SQUARE", "accepts": ["yellow"], "capacity": 8, "shape": "square" },
    { "nodeId": "TRIANGLE", "accepts": ["yellow"], "capacity": 8, "shape": "triangle" }
  ],
  "switches": [
    { "id": "S1", "nodeId": "J1", "routes": ["E_ROUND", "E_SQUARE", "E_TRIANGLE"], "initialRoute": 0 }
  ],
  "waves": [
    { "tick": 8, "sourceNode": "SRC", "color": "yellow", "count": 1, "spacingTicks": 12, "shape": "triangle" }
  ],
  "win": {
    "deliveries": 1,
    "timeLimitTicks": 320,
    "perfectMaxSwitches": 2,
    "stars": { "two": 670, "three": 860 }
  },
  "economy": { "baseTickets": 34, "perfectBonus": 17 }
}
